lineOne,lineTwo,lineThree,authorOne,authorTwo,authorThree
His watch is over!,Not the guy with chains and whips,Queens of the Stone Age,rvncto,icelordz,fansns
Thank you very much,What is there to weigh in on?,"Dang, that cover art!",nagami09,st_michael,coldpause
Thanks for the answer!,What people think about me.,no.. but record that!,justduck01,maggiebear,Hirojima
This thought makes me hard,Obama has the best words.,Well that backfired.,QueefBucket,PickledHate,royal_rocker
"*the Hitler Youth, THY*",Is... Is it patrick stewart?,Im always clapping.,MWhodak,WisdomTooth8,SoupOfSomeYoungGuy
THEY DO IT FOR FREE,No roads lead to Nick Mason,Que lo que loco?,jackieclay,mightykingfish,xEONx
Huxtable hustle,dude just make the spaghetti,Poop after shower ,silver_pockets,RaspberryAndAmber,Pmcandew
This guy understands.,You have a ticket open?,All hail the Great Lord!,green_meklar,VirtualEuphoria,volkanos
Epic Fail Update.....,Both are also named Tina,#WE MUST GO DEEPER!,Nitestal,fwest27,ThatsMyHoverboard
Perfect for putting.,Now send him out for Duck Tape.,Only private schools,5ype,stellacampus,sleaze_bag_alert
"i say. what what, eh?","Ah okay, that clears things up. ",Thank you for the trade!,Silverspy01,radishestonight,Aerija
Fraud endorses fraud.,He facing life in prison.,"""Eh"" certainly is",basec0m,Popcorniqueen,SorryIAmFourEels
"half brown, can confirm ","permanent for that match, yes",i approve of this. ,zedis-lapedis,dasmekoad,Andre_Iguana
Nice! Looking good dude!,This is my favorite post. ,You can ignore me.,Thumpd,TheDude44464,constantly-sick
"So, die either way?","Got something against it, bud? c:",Dat mint highlight tho... ,Ekudar,DenebVegaAltair,Yolanda_Neptune
Priestess Sakura x Kaden,Are they emotionally fucked? /s,First grade anarchists,Enn-00,lawr11,lordatomosk
are you happy though?,Yup. It finished in April.,Steven Avery,fortheloveofcoffee1,Kananaskis_Country,KlehmM
Make her an ex-so.,Have you already purchased?,"Rest easy, brother.",fallofcivilization,jonker5101,pachonga9
thanks for the input :P,Sit on my face already!,Then. What did he mean?,angelwingx,mercuserious,Ithurtsprecious
Japanese castles,Look at you on your high horse,How does that happen?,The_Silver_Falcon,jamitwityou,TristanJeremiah
"Enter, thank for this.",Trapped inside or eaten by?,Working fine for me.,Dalagr,whobroughtflapjacks,tarentmarsh
Yeah that just not true,"That would be amazing, thanks!",Leave me out of this. ,mateorayo,abigaila,wil
What a piece of shit.,So is yours if you think that.,Shakes me to the core.,AllMyName,Surfing_Ninjas,RTSUbiytsa
"Me too, friend, me too.",In bold it says comes with dupes,Parking crater....... Check!,AdamantiumFoil,chavezz4,iamjayjay
Or a Pedigree.,Ty op for the giveaway ,The Social Network,ooginator,xXCurry_In_A_HurryXx,DasLischenPischen
